{
  "schema_version": "PolicyDecision_v1",
  "decision_id": "decision_1777681382092_f411c865",
  "envelope_id": "bts_gate_20260502T002301Z_0487f74d",
  "stage_id": "BTS_V4_GATE_WRAPPED_RUNTIME",
  "decision": "ALLOW",
  "reason_code": "LOW_RISK_BOUNDED_ACTION",
  "rationale": "Envelope passed schema, method, path, SEE, approval, and bounded-budget checks.",
  "decided_at_utc": "2026-05-02T00:23:02Z",
  "enforced_by": "pre_tool_action_gate_v1",
  "receipt_path": "/mnt/data/Metablooms_OS/runtime/governance/receipts/per_action_tool_interception_v1/bts_gate_20260502T002301Z_0487f74d.decision.json",
  "safe_to_execute": true,
  "required_next_action": "execute_action_and_write_action_receipt",
  "matched_rules": [
    "schema.required",
    "path.safety",
    "runaway.breaker",
    "method.reliability"
  ],
  "envelope_sha256": "e15dd764540151c99a635a16756704a48a14ff30a1b35d0fbb2b55bbda8c5ad9"
}
