{
  "schema_version": "PolicyDecision_v1",
  "decision_id": "decision_1777685361564_69b9fddb",
  "envelope_id": "bts_write_receipt_20260502T012921Z",
  "stage_id": "BTS_V4_OS_GATED_WRITE",
  "decision": "ALLOW",
  "reason_code": "LOW_RISK_BOUNDED_ACTION",
  "rationale": "Envelope passed schema, method, path, SEE, approval, and bounded-budget checks.",
  "decided_at_utc": "2026-05-02T01:29:21Z",
  "enforced_by": "pre_tool_action_gate_v1",
  "receipt_path": "/mnt/data/Metablooms_OS/runtime/governance/receipts/per_action_tool_interception_v1/bts_write_receipt_20260502T012921Z.decision.json",
  "safe_to_execute": true,
  "required_next_action": "execute_action_and_write_action_receipt",
  "matched_rules": [
    "schema.required",
    "path.safety",
    "runaway.breaker",
    "method.reliability"
  ],
  "envelope_sha256": "ab3a599d4982e5eb38a1a628995c78ac318d6adc30bfc9f5291504ece3bfb235"
}
