{
  "schema_version": "PolicyDecision_v1",
  "decision_id": "decision_1777687616409_9bc4fecf",
  "envelope_id": "bts_write_competence_20260502T020656Z",
  "stage_id": "BTS_V4_OS_GATED_WRITE",
  "decision": "ALLOW",
  "reason_code": "LOW_RISK_BOUNDED_ACTION",
  "rationale": "Envelope passed schema, method, path, SEE, approval, and bounded-budget checks.",
  "decided_at_utc": "2026-05-02T02:06:56Z",
  "enforced_by": "pre_tool_action_gate_v1",
  "receipt_path": "/mnt/data/Metablooms_OS/runtime/governance/receipts/per_action_tool_interception_v1/bts_write_competence_20260502T020656Z.decision.json",
  "safe_to_execute": true,
  "required_next_action": "execute_action_and_write_action_receipt",
  "matched_rules": [
    "schema.required",
    "path.safety",
    "runaway.breaker",
    "method.reliability"
  ],
  "envelope_sha256": "40006b766d932853e69179399fe78a9d27e7401784cecf1d8c522b190464baf4"
}
