{
  "schema_version": "PolicyDecision_v1",
  "decision_id": "decision_1777685168614_5af04d87",
  "envelope_id": "STAGE6I_WRITE_FIXTURE_20260502T012608Z_filesystem_write",
  "stage_id": "STAGE6I",
  "decision": "ALLOW",
  "reason_code": "LOW_RISK_BOUNDED_ACTION",
  "rationale": "Envelope passed schema, method, path, SEE, approval, and bounded-budget checks.",
  "decided_at_utc": "2026-05-02T01:26:08Z",
  "enforced_by": "pre_tool_action_gate_v1",
  "receipt_path": "/mnt/data/Metablooms_OS/runtime/governance/receipts/per_action_tool_interception_v1/STAGE6I_WRITE_FIXTURE_20260502T012608Z_filesystem_write.decision.json",
  "safe_to_execute": true,
  "required_next_action": "execute_action_and_write_action_receipt",
  "matched_rules": [
    "schema.required",
    "path.safety",
    "runaway.breaker",
    "method.reliability"
  ],
  "envelope_sha256": "ede04cb1b0d0effb546248c47471067d1e4b2b8026ae51e9354c56d49046cbb1"
}
