{
  "schema_version": "PolicyDecision_v1",
  "decision_id": "decision_1777685330783_66b6a48f",
  "envelope_id": "STAGE6I_NODE_EXPORT_FIXTURE2_20260502T012848Z_node_zip_profile_export",
  "stage_id": "STAGE6I",
  "decision": "ALLOW",
  "reason_code": "LOW_RISK_BOUNDED_ACTION",
  "rationale": "Envelope passed schema, method, path, SEE, approval, and bounded-budget checks.",
  "decided_at_utc": "2026-05-02T01:28:50Z",
  "enforced_by": "pre_tool_action_gate_v1",
  "receipt_path": "/mnt/data/Metablooms_OS/runtime/governance/receipts/per_action_tool_interception_v1/STAGE6I_NODE_EXPORT_FIXTURE2_20260502T012848Z_node_zip_profile_export.decision.json",
  "safe_to_execute": true,
  "required_next_action": "execute_action_and_write_action_receipt",
  "matched_rules": [
    "schema.required",
    "path.safety",
    "runaway.breaker",
    "method.reliability"
  ],
  "envelope_sha256": "0836010bbed84f8270d9b55c5c6143bac6be739736dd5b1da157c8dcc1b1477a"
}
